<?xml version="1.0" encoding="utf-8"?>

<!DOCTYPE predictions
[
  <!ELEMENT predictions (prediction*)>
  <!ATTLIST predictions version CDATA "3.8.0">
  <!ATTLIST predictions name CDATA #REQUIRED>

  <!ELEMENT prediction ((actual_label,predicted_label,error,(prediction|distribution),attributes?)|(actual_value,predicted_value,error,attributes?))>
  <!ATTLIST prediction index CDATA #REQUIRED>

  <!ELEMENT actual_label ANY>
  <!ATTLIST actual_label index CDATA #REQUIRED>
  <!ELEMENT predicted_label ANY>
  <!ATTLIST predicted_label index CDATA #REQUIRED>
  <!ELEMENT error ANY>
  <!ELEMENT prediction ANY>
  <!ELEMENT distribution (class_label+)>
  <!ELEMENT class_label ANY>
  <!ATTLIST class_label index CDATA #REQUIRED>
  <!ATTLIST class_label predicted (yes|no) "no">
  <!ELEMENT actual_value ANY>
  <!ELEMENT predicted_value ANY>
  <!ELEMENT attributes (attribute+)>
  <!ELEMENT attribute ANY>
  <!ATTLIST attribute index CDATA #REQUIRED>
  <!ATTLIST attribute name CDATA #REQUIRED>
  <!ATTLIST attribute type (numeric|date|nominal|string|relational) #REQUIRED>
]
>

<predictions version="3.8.0" name="anomalous-traffic-weka.filters.unsupervised.attribute.Remove-R2,6-10">
  <prediction index="1">
    <actual_label index="1">normal</actual_label>
    <predicted_label index="1">normal</predicted_label>
    <error>no</error>
    <prediction>1</prediction>
    <attributes>
      <attribute index="1" name="ts" type="numeric">1483702380.51</attribute>
    </attributes>
  </prediction>
  <prediction index="2">
    <actual_label index="1">normal</actual_label>
    <predicted_label index="1">normal</predicted_label>
    <error>no</error>
    <prediction>1</prediction>
    <attributes>
      <attribute index="1" name="ts" type="numeric">1483704765.51</attribute>
    </attributes>
  </prediction>
  <prediction index="3">
    <actual_label index="1">normal</actual_label>
    <predicted_label index="1">normal</predicted_label>
    <error>no</error>
    <prediction>1</prediction>
    <attributes>
      <attribute index="1" name="ts" type="numeric">1483704810.51</attribute>
    </attributes>
  </prediction>
  <prediction index="4">
    <actual_label index="1">normal</actual_label>
    <predicted_label index="1">normal</predicted_label>
    <error>no</error>
    <prediction>1</prediction>
    <attributes>
      <attribute index="1" name="ts" type="numeric">1483704855.51</attribute>
    </attributes>
  </prediction>
  <prediction index="5">
    <actual_label index="1">normal</actual_label>
    <predicted_label index="1">normal</predicted_label>
    <error>no</error>
    <prediction>1</prediction>
    <attributes>
      <attribute index="1" name="ts" type="numeric">1483704900.51</attribute>
    </attributes>
  </prediction>
  <prediction index="6">
    <actual_label index="1">normal</actual_label>
    <predicted_label index="1">normal</predicted_label>
    <error>no</error>
    <prediction>1</prediction>
    <attributes>
      <attribute index="1" name="ts" type="numeric">1483705890.51</attribute>
    </attributes>
  </prediction>
  <prediction index="7">
    <actual_label index="1">normal</actual_label>
    <predicted_label index="1">normal</predicted_label>
    <error>no</error>
    <prediction>1</prediction>
    <attributes>
      <attribute index="1" name="ts" type="numeric">1483705935.51</attribute>
    </attributes>
  </prediction>
  <prediction index="8">
    <actual_label index="1">normal</actual_label>
    <predicted_label index="1">normal</predicted_label>
    <error>no</error>
    <prediction>1</prediction>
    <attributes>
      <attribute index="1" name="ts" type="numeric">1483705980.51</attribute>
    </attributes>
  </prediction>
  <prediction index="9">
    <actual_label index="2">anomaly</actual_label>
    <predicted_label index="1">normal</predicted_label>
    <error>yes</error>
    <prediction>1</prediction>
    <attributes>
      <attribute index="1" name="ts" type="numeric">1483706025.51</attribute>
    </attributes>
  </prediction>
  <prediction index="10">
    <actual_label index="2">anomaly</actual_label>
    <predicted_label index="2">anomaly</predicted_label>
    <error>no</error>
    <prediction>1</prediction>
    <attributes>
      <attribute index="1" name="ts" type="numeric">1483706070.51</attribute>
    </attributes>
  </prediction>
  <prediction index="11">
    <actual_label index="2">anomaly</actual_label>
    <predicted_label index="2">anomaly</predicted_label>
    <error>no</error>
    <prediction>1</prediction>
    <attributes>
      <attribute index="1" name="ts" type="numeric">1483706115.51</attribute>
    </attributes>
  </prediction>
  <prediction index="12">
    <actual_label index="2">anomaly</actual_label>
    <predicted_label index="2">anomaly</predicted_label>
    <error>no</error>
    <prediction>1</prediction>
    <attributes>
      <attribute index="1" name="ts" type="numeric">1483706160.51</attribute>
    </attributes>
  </prediction>
  <prediction index="13">
    <actual_label index="2">anomaly</actual_label>
    <predicted_label index="2">anomaly</predicted_label>
    <error>no</error>
    <prediction>1</prediction>
    <attributes>
      <attribute index="1" name="ts" type="numeric">1483706205.51</attribute>
    </attributes>
  </prediction>
  <prediction index="14">
    <actual_label index="2">anomaly</actual_label>
    <predicted_label index="2">anomaly</predicted_label>
    <error>no</error>
    <prediction>1</prediction>
    <attributes>
      <attribute index="1" name="ts" type="numeric">1483706250.51</attribute>
    </attributes>
  </prediction>
  <prediction index="15">
    <actual_label index="2">anomaly</actual_label>
    <predicted_label index="2">anomaly</predicted_label>
    <error>no</error>
    <prediction>1</prediction>
    <attributes>
      <attribute index="1" name="ts" type="numeric">1483706295.51</attribute>
    </attributes>
  </prediction>
  <prediction index="16">
    <actual_label index="2">anomaly</actual_label>
    <predicted_label index="2">anomaly</predicted_label>
    <error>no</error>
    <prediction>1</prediction>
    <attributes>
      <attribute index="1" name="ts" type="numeric">1483706340.51</attribute>
    </attributes>
  </prediction>
  <prediction index="17">
    <actual_label index="2">anomaly</actual_label>
    <predicted_label index="2">anomaly</predicted_label>
    <error>no</error>
    <prediction>1</prediction>
    <attributes>
      <attribute index="1" name="ts" type="numeric">1483706385.51</attribute>
    </attributes>
  </prediction>
  <prediction index="18">
    <actual_label index="2">anomaly</actual_label>
    <predicted_label index="2">anomaly</predicted_label>
    <error>no</error>
    <prediction>1</prediction>
    <attributes>
      <attribute index="1" name="ts" type="numeric">1483706430.51</attribute>
    </attributes>
  </prediction>
  <prediction index="19">
    <actual_label index="2">anomaly</actual_label>
    <predicted_label index="2">anomaly</predicted_label>
    <error>no</error>
    <prediction>1</prediction>
    <attributes>
      <attribute index="1" name="ts" type="numeric">1483706475.51</attribute>
    </attributes>
  </prediction>
  <prediction index="20">
    <actual_label index="1">normal</actual_label>
    <predicted_label index="1">normal</predicted_label>
    <error>no</error>
    <prediction>1</prediction>
    <attributes>
      <attribute index="1" name="ts" type="numeric">1483707105.51</attribute>
    </attributes>
  </prediction>
  <prediction index="21">
    <actual_label index="1">normal</actual_label>
    <predicted_label index="1">normal</predicted_label>
    <error>no</error>
    <prediction>1</prediction>
    <attributes>
      <attribute index="1" name="ts" type="numeric">1483707150.51</attribute>
    </attributes>
  </prediction>
  <prediction index="22">
    <actual_label index="1">normal</actual_label>
    <predicted_label index="1">normal</predicted_label>
    <error>no</error>
    <prediction>1</prediction>
    <attributes>
      <attribute index="1" name="ts" type="numeric">1483707195.51</attribute>
    </attributes>
  </prediction>
  <prediction index="23">
    <actual_label index="1">normal</actual_label>
    <predicted_label index="1">normal</predicted_label>
    <error>no</error>
    <prediction>1</prediction>
    <attributes>
      <attribute index="1" name="ts" type="numeric">1483707240.51</attribute>
    </attributes>
  </prediction>
  <prediction index="24">
    <actual_label index="1">normal</actual_label>
    <predicted_label index="1">normal</predicted_label>
    <error>no</error>
    <prediction>1</prediction>
    <attributes>
      <attribute index="1" name="ts" type="numeric">1483707285.51</attribute>
    </attributes>
  </prediction>
  <prediction index="25">
    <actual_label index="1">normal</actual_label>
    <predicted_label index="1">normal</predicted_label>
    <error>no</error>
    <prediction>1</prediction>
    <attributes>
      <attribute index="1" name="ts" type="numeric">1483707330.51</attribute>
    </attributes>
  </prediction>
  <prediction index="26">
    <actual_label index="1">normal</actual_label>
    <predicted_label index="1">normal</predicted_label>
    <error>no</error>
    <prediction>1</prediction>
    <attributes>
      <attribute index="1" name="ts" type="numeric">1483707375.51</attribute>
    </attributes>
  </prediction>
  <prediction index="27">
    <actual_label index="1">normal</actual_label>
    <predicted_label index="1">normal</predicted_label>
    <error>no</error>
    <prediction>1</prediction>
    <attributes>
      <attribute index="1" name="ts" type="numeric">1483707420.51</attribute>
    </attributes>
  </prediction>
  <prediction index="28">
    <actual_label index="1">normal</actual_label>
    <predicted_label index="1">normal</predicted_label>
    <error>no</error>
    <prediction>1</prediction>
    <attributes>
      <attribute index="1" name="ts" type="numeric">1483707465.51</attribute>
    </attributes>
  </prediction>
  <prediction index="29">
    <actual_label index="1">normal</actual_label>
    <predicted_label index="1">normal</predicted_label>
    <error>no</error>
    <prediction>1</prediction>
    <attributes>
      <attribute index="1" name="ts" type="numeric">1483707510.51</attribute>
    </attributes>
  </prediction>
  <prediction index="30">
    <actual_label index="1">normal</actual_label>
    <predicted_label index="1">normal</predicted_label>
    <error>no</error>
    <prediction>1</prediction>
    <attributes>
      <attribute index="1" name="ts" type="numeric">1483707555.51</attribute>
    </attributes>
  </prediction>
  <prediction index="31">
    <actual_label index="1">normal</actual_label>
    <predicted_label index="1">normal</predicted_label>
    <error>no</error>
    <prediction>1</prediction>
    <attributes>
      <attribute index="1" name="ts" type="numeric">1483707600.51</attribute>
    </attributes>
  </prediction>
  <prediction index="32">
    <actual_label index="1">normal</actual_label>
    <predicted_label index="1">normal</predicted_label>
    <error>no</error>
    <prediction>1</prediction>
    <attributes>
      <attribute index="1" name="ts" type="numeric">1483707645.51</attribute>
    </attributes>
  </prediction>
  <prediction index="33">
    <actual_label index="1">normal</actual_label>
    <predicted_label index="1">normal</predicted_label>
    <error>no</error>
    <prediction>1</prediction>
    <attributes>
      <attribute index="1" name="ts" type="numeric">1483710660.51</attribute>
    </attributes>
  </prediction>
  <prediction index="34">
    <actual_label index="1">normal</actual_label>
    <predicted_label index="1">normal</predicted_label>
    <error>no</error>
    <prediction>1</prediction>
    <attributes>
      <attribute index="1" name="ts" type="numeric">1483710705.51</attribute>
    </attributes>
  </prediction>
  <prediction index="35">
    <actual_label index="1">normal</actual_label>
    <predicted_label index="1">normal</predicted_label>
    <error>no</error>
    <prediction>1</prediction>
    <attributes>
      <attribute index="1" name="ts" type="numeric">1483710750.51</attribute>
    </attributes>
  </prediction>
  <prediction index="36">
    <actual_label index="1">normal</actual_label>
    <predicted_label index="1">normal</predicted_label>
    <error>no</error>
    <prediction>1</prediction>
    <attributes>
      <attribute index="1" name="ts" type="numeric">1483710795.51</attribute>
    </attributes>
  </prediction>
  <prediction index="37">
    <actual_label index="1">normal</actual_label>
    <predicted_label index="1">normal</predicted_label>
    <error>no</error>
    <prediction>1</prediction>
    <attributes>
      <attribute index="1" name="ts" type="numeric">1483710840.51</attribute>
    </attributes>
  </prediction>
  <prediction index="38">
    <actual_label index="1">normal</actual_label>
    <predicted_label index="1">normal</predicted_label>
    <error>no</error>
    <prediction>1</prediction>
    <attributes>
      <attribute index="1" name="ts" type="numeric">1483710885.51</attribute>
    </attributes>
  </prediction>
  <prediction index="39">
    <actual_label index="1">normal</actual_label>
    <predicted_label index="1">normal</predicted_label>
    <error>no</error>
    <prediction>1</prediction>
    <attributes>
      <attribute index="1" name="ts" type="numeric">1483710930.51</attribute>
    </attributes>
  </prediction>
  <prediction index="40">
    <actual_label index="1">normal</actual_label>
    <predicted_label index="1">normal</predicted_label>
    <error>no</error>
    <prediction>1</prediction>
    <attributes>
      <attribute index="1" name="ts" type="numeric">1483710975.51</attribute>
    </attributes>
  </prediction>
  <prediction index="41">
    <actual_label index="1">normal</actual_label>
    <predicted_label index="1">normal</predicted_label>
    <error>no</error>
    <prediction>1</prediction>
    <attributes>
      <attribute index="1" name="ts" type="numeric">1483711020.51</attribute>
    </attributes>
  </prediction>
  <prediction index="42">
    <actual_label index="1">normal</actual_label>
    <predicted_label index="1">normal</predicted_label>
    <error>no</error>
    <prediction>1</prediction>
    <attributes>
      <attribute index="1" name="ts" type="numeric">1483711065.51</attribute>
    </attributes>
  </prediction>
  <prediction index="43">
    <actual_label index="1">normal</actual_label>
    <predicted_label index="1">normal</predicted_label>
    <error>no</error>
    <prediction>1</prediction>
    <attributes>
      <attribute index="1" name="ts" type="numeric">1483711110.51</attribute>
    </attributes>
  </prediction>
  <prediction index="44">
    <actual_label index="2">anomaly</actual_label>
    <predicted_label index="2">anomaly</predicted_label>
    <error>no</error>
    <prediction>1</prediction>
    <attributes>
      <attribute index="1" name="ts" type="numeric">1483711155.51</attribute>
    </attributes>
  </prediction>
  <prediction index="45">
    <actual_label index="2">anomaly</actual_label>
    <predicted_label index="2">anomaly</predicted_label>
    <error>no</error>
    <prediction>1</prediction>
    <attributes>
      <attribute index="1" name="ts" type="numeric">1483711200.51</attribute>
    </attributes>
  </prediction>
  <prediction index="46">
    <actual_label index="2">anomaly</actual_label>
    <predicted_label index="2">anomaly</predicted_label>
    <error>no</error>
    <prediction>1</prediction>
    <attributes>
      <attribute index="1" name="ts" type="numeric">1483711245.51</attribute>
    </attributes>
  </prediction>
  <prediction index="47">
    <actual_label index="2">anomaly</actual_label>
    <predicted_label index="2">anomaly</predicted_label>
    <error>no</error>
    <prediction>1</prediction>
    <attributes>
      <attribute index="1" name="ts" type="numeric">1483711290.51</attribute>
    </attributes>
  </prediction>
  <prediction index="48">
    <actual_label index="2">anomaly</actual_label>
    <predicted_label index="2">anomaly</predicted_label>
    <error>no</error>
    <prediction>1</prediction>
    <attributes>
      <attribute index="1" name="ts" type="numeric">1483711335.51</attribute>
    </attributes>
  </prediction>
  <prediction index="49">
    <actual_label index="2">anomaly</actual_label>
    <predicted_label index="2">anomaly</predicted_label>
    <error>no</error>
    <prediction>1</prediction>
    <attributes>
      <attribute index="1" name="ts" type="numeric">1483711380.51</attribute>
    </attributes>
  </prediction>
  <prediction index="50">
    <actual_label index="2">anomaly</actual_label>
    <predicted_label index="2">anomaly</predicted_label>
    <error>no</error>
    <prediction>1</prediction>
    <attributes>
      <attribute index="1" name="ts" type="numeric">1483711425.51</attribute>
    </attributes>
  </prediction>
  <prediction index="51">
    <actual_label index="2">anomaly</actual_label>
    <predicted_label index="2">anomaly</predicted_label>
    <error>no</error>
    <prediction>1</prediction>
    <attributes>
      <attribute index="1" name="ts" type="numeric">1483711470.51</attribute>
    </attributes>
  </prediction>
  <prediction index="52">
    <actual_label index="2">anomaly</actual_label>
    <predicted_label index="2">anomaly</predicted_label>
    <error>no</error>
    <prediction>1</prediction>
    <attributes>
      <attribute index="1" name="ts" type="numeric">1483711515.51</attribute>
    </attributes>
  </prediction>
  <prediction index="53">
    <actual_label index="2">anomaly</actual_label>
    <predicted_label index="2">anomaly</predicted_label>
    <error>no</error>
    <prediction>1</prediction>
    <attributes>
      <attribute index="1" name="ts" type="numeric">1483711560.51</attribute>
    </attributes>
  </prediction>
  <prediction index="54">
    <actual_label index="2">anomaly</actual_label>
    <predicted_label index="2">anomaly</predicted_label>
    <error>no</error>
    <prediction>1</prediction>
    <attributes>
      <attribute index="1" name="ts" type="numeric">1483711605.51</attribute>
    </attributes>
  </prediction>
  <prediction index="55">
    <actual_label index="1">normal</actual_label>
    <predicted_label index="1">normal</predicted_label>
    <error>no</error>
    <prediction>1</prediction>
    <attributes>
      <attribute index="1" name="ts" type="numeric">1483712415.51</attribute>
    </attributes>
  </prediction>
  <prediction index="56">
    <actual_label index="1">normal</actual_label>
    <predicted_label index="1">normal</predicted_label>
    <error>no</error>
    <prediction>1</prediction>
    <attributes>
      <attribute index="1" name="ts" type="numeric">1483712460.51</attribute>
    </attributes>
  </prediction>
  <prediction index="57">
    <actual_label index="1">normal</actual_label>
    <predicted_label index="1">normal</predicted_label>
    <error>no</error>
    <prediction>1</prediction>
    <attributes>
      <attribute index="1" name="ts" type="numeric">1483712505.51</attribute>
    </attributes>
  </prediction>
  <prediction index="58">
    <actual_label index="1">normal</actual_label>
    <predicted_label index="1">normal</predicted_label>
    <error>no</error>
    <prediction>1</prediction>
    <attributes>
      <attribute index="1" name="ts" type="numeric">1483712550.51</attribute>
    </attributes>
  </prediction>
  <prediction index="59">
    <actual_label index="1">normal</actual_label>
    <predicted_label index="1">normal</predicted_label>
    <error>no</error>
    <prediction>1</prediction>
    <attributes>
      <attribute index="1" name="ts" type="numeric">1483712595.51</attribute>
    </attributes>
  </prediction>
  <prediction index="60">
    <actual_label index="1">normal</actual_label>
    <predicted_label index="1">normal</predicted_label>
    <error>no</error>
    <prediction>1</prediction>
    <attributes>
      <attribute index="1" name="ts" type="numeric">1483712640.51</attribute>
    </attributes>
  </prediction>
  <prediction index="61">
    <actual_label index="1">normal</actual_label>
    <predicted_label index="1">normal</predicted_label>
    <error>no</error>
    <prediction>1</prediction>
    <attributes>
      <attribute index="1" name="ts" type="numeric">1483712685.51</attribute>
    </attributes>
  </prediction>
  <prediction index="62">
    <actual_label index="1">normal</actual_label>
    <predicted_label index="1">normal</predicted_label>
    <error>no</error>
    <prediction>1</prediction>
    <attributes>
      <attribute index="1" name="ts" type="numeric">1483712730.51</attribute>
    </attributes>
  </prediction>
  <prediction index="63">
    <actual_label index="1">normal</actual_label>
    <predicted_label index="1">normal</predicted_label>
    <error>no</error>
    <prediction>1</prediction>
    <attributes>
      <attribute index="1" name="ts" type="numeric">1483712775.51</attribute>
    </attributes>
  </prediction>
  <prediction index="64">
    <actual_label index="1">normal</actual_label>
    <predicted_label index="1">normal</predicted_label>
    <error>no</error>
    <prediction>1</prediction>
    <attributes>
      <attribute index="1" name="ts" type="numeric">1483712820.51</attribute>
    </attributes>
  </prediction>
  <prediction index="65">
    <actual_label index="1">normal</actual_label>
    <predicted_label index="1">normal</predicted_label>
    <error>no</error>
    <prediction>1</prediction>
    <attributes>
      <attribute index="1" name="ts" type="numeric">1483713135.51</attribute>
    </attributes>
  </prediction>
  <prediction index="66">
    <actual_label index="1">normal</actual_label>
    <predicted_label index="1">normal</predicted_label>
    <error>no</error>
    <prediction>1</prediction>
    <attributes>
      <attribute index="1" name="ts" type="numeric">1483713810.51</attribute>
    </attributes>
  </prediction>
  <prediction index="67">
    <actual_label index="1">normal</actual_label>
    <predicted_label index="1">normal</predicted_label>
    <error>no</error>
    <prediction>1</prediction>
    <attributes>
      <attribute index="1" name="ts" type="numeric">1483713855.51</attribute>
    </attributes>
  </prediction>
  <prediction index="68">
    <actual_label index="1">normal</actual_label>
    <predicted_label index="1">normal</predicted_label>
    <error>no</error>
    <prediction>1</prediction>
    <attributes>
      <attribute index="1" name="ts" type="numeric">1483713900.51</attribute>
    </attributes>
  </prediction>
  <prediction index="69">
    <actual_label index="1">normal</actual_label>
    <predicted_label index="1">normal</predicted_label>
    <error>no</error>
    <prediction>1</prediction>
    <attributes>
      <attribute index="1" name="ts" type="numeric">1483713945.51</attribute>
    </attributes>
  </prediction>
  <prediction index="70">
    <actual_label index="1">normal</actual_label>
    <predicted_label index="1">normal</predicted_label>
    <error>no</error>
    <prediction>1</prediction>
    <attributes>
      <attribute index="1" name="ts" type="numeric">1483713990.51</attribute>
    </attributes>
  </prediction>
  <prediction index="71">
    <actual_label index="1">normal</actual_label>
    <predicted_label index="1">normal</predicted_label>
    <error>no</error>
    <prediction>1</prediction>
    <attributes>
      <attribute index="1" name="ts" type="numeric">1483714035.51</attribute>
    </attributes>
  </prediction>
  <prediction index="72">
    <actual_label index="1">normal</actual_label>
    <predicted_label index="1">normal</predicted_label>
    <error>no</error>
    <prediction>1</prediction>
    <attributes>
      <attribute index="1" name="ts" type="numeric">1483714080.51</attribute>
    </attributes>
  </prediction>
  <prediction index="73">
    <actual_label index="1">normal</actual_label>
    <predicted_label index="1">normal</predicted_label>
    <error>no</error>
    <prediction>1</prediction>
    <attributes>
      <attribute index="1" name="ts" type="numeric">1483714125.51</attribute>
    </attributes>
  </prediction>
  <prediction index="74">
    <actual_label index="1">normal</actual_label>
    <predicted_label index="1">normal</predicted_label>
    <error>no</error>
    <prediction>1</prediction>
    <attributes>
      <attribute index="1" name="ts" type="numeric">1483714170.51</attribute>
    </attributes>
  </prediction>
  <prediction index="75">
    <actual_label index="1">normal</actual_label>
    <predicted_label index="1">normal</predicted_label>
    <error>no</error>
    <prediction>1</prediction>
    <attributes>
      <attribute index="1" name="ts" type="numeric">1483714215.51</attribute>
    </attributes>
  </prediction>
  <prediction index="76">
    <actual_label index="1">normal</actual_label>
    <predicted_label index="1">normal</predicted_label>
    <error>no</error>
    <prediction>1</prediction>
    <attributes>
      <attribute index="1" name="ts" type="numeric">1483714260.51</attribute>
    </attributes>
  </prediction>
  <prediction index="77">
    <actual_label index="1">normal</actual_label>
    <predicted_label index="1">normal</predicted_label>
    <error>no</error>
    <prediction>1</prediction>
    <attributes>
      <attribute index="1" name="ts" type="numeric">1483718220.51</attribute>
    </attributes>
  </prediction>
  <prediction index="78">
    <actual_label index="1">normal</actual_label>
    <predicted_label index="1">normal</predicted_label>
    <error>no</error>
    <prediction>1</prediction>
    <attributes>
      <attribute index="1" name="ts" type="numeric">1483718265.51</attribute>
    </attributes>
  </prediction>
  <prediction index="79">
    <actual_label index="1">normal</actual_label>
    <predicted_label index="1">normal</predicted_label>
    <error>no</error>
    <prediction>1</prediction>
    <attributes>
      <attribute index="1" name="ts" type="numeric">1483718310.51</attribute>
    </attributes>
  </prediction>
  <prediction index="80">
    <actual_label index="1">normal</actual_label>
    <predicted_label index="1">normal</predicted_label>
    <error>no</error>
    <prediction>1</prediction>
    <attributes>
      <attribute index="1" name="ts" type="numeric">1483718355.51</attribute>
    </attributes>
  </prediction>
  <prediction index="81">
    <actual_label index="1">normal</actual_label>
    <predicted_label index="1">normal</predicted_label>
    <error>no</error>
    <prediction>1</prediction>
    <attributes>
      <attribute index="1" name="ts" type="numeric">1483718400.51</attribute>
    </attributes>
  </prediction>
  <prediction index="82">
    <actual_label index="1">normal</actual_label>
    <predicted_label index="1">normal</predicted_label>
    <error>no</error>
    <prediction>1</prediction>
    <attributes>
      <attribute index="1" name="ts" type="numeric">1483718445.51</attribute>
    </attributes>
  </prediction>
  <prediction index="83">
    <actual_label index="1">normal</actual_label>
    <predicted_label index="1">normal</predicted_label>
    <error>no</error>
    <prediction>1</prediction>
    <attributes>
      <attribute index="1" name="ts" type="numeric">1483718490.51</attribute>
    </attributes>
  </prediction>
  <prediction index="84">
    <actual_label index="1">normal</actual_label>
    <predicted_label index="1">normal</predicted_label>
    <error>no</error>
    <prediction>1</prediction>
    <attributes>
      <attribute index="1" name="ts" type="numeric">1483718535.51</attribute>
    </attributes>
  </prediction>
  <prediction index="85">
    <actual_label index="1">normal</actual_label>
    <predicted_label index="1">normal</predicted_label>
    <error>no</error>
    <prediction>1</prediction>
    <attributes>
      <attribute index="1" name="ts" type="numeric">1483719075.51</attribute>
    </attributes>
  </prediction>
  <prediction index="86">
    <actual_label index="1">normal</actual_label>
    <predicted_label index="1">normal</predicted_label>
    <error>no</error>
    <prediction>1</prediction>
    <attributes>
      <attribute index="1" name="ts" type="numeric">1483719120.51</attribute>
    </attributes>
  </prediction>
  <prediction index="87">
    <actual_label index="1">normal</actual_label>
    <predicted_label index="1">normal</predicted_label>
    <error>no</error>
    <prediction>1</prediction>
    <attributes>
      <attribute index="1" name="ts" type="numeric">1483719165.51</attribute>
    </attributes>
  </prediction>
  <prediction index="88">
    <actual_label index="1">normal</actual_label>
    <predicted_label index="1">normal</predicted_label>
    <error>no</error>
    <prediction>1</prediction>
    <attributes>
      <attribute index="1" name="ts" type="numeric">1483719210.51</attribute>
    </attributes>
  </prediction>
  <prediction index="89">
    <actual_label index="1">normal</actual_label>
    <predicted_label index="1">normal</predicted_label>
    <error>no</error>
    <prediction>1</prediction>
    <attributes>
      <attribute index="1" name="ts" type="numeric">1483719255.51</attribute>
    </attributes>
  </prediction>
  <prediction index="90">
    <actual_label index="1">normal</actual_label>
    <predicted_label index="1">normal</predicted_label>
    <error>no</error>
    <prediction>1</prediction>
    <attributes>
      <attribute index="1" name="ts" type="numeric">1483719300.51</attribute>
    </attributes>
  </prediction>
  <prediction index="91">
    <actual_label index="1">normal</actual_label>
    <predicted_label index="1">normal</predicted_label>
    <error>no</error>
    <prediction>1</prediction>
    <attributes>
      <attribute index="1" name="ts" type="numeric">1483719345.51</attribute>
    </attributes>
  </prediction>
  <prediction index="92">
    <actual_label index="1">normal</actual_label>
    <predicted_label index="1">normal</predicted_label>
    <error>no</error>
    <prediction>1</prediction>
    <attributes>